{
    "Description": "Default user profile settings for Windows 11.",
    "MinimumBuild": "10.0.22000",
    "MaximumBuild": "10.0.29999",
    "Targets": {
        "Platforms": [
            "client"
        ],
        "Models": [
            "physical",
            "virtual"
        ]
    },
    "MachineRegistry": {
        "ChangeOwner": [],
        "Set": [],
        "Remove": []
    },
    "UserRegistry": {
        "Set": [
            {
                "path": "HKCU:\\Software\\Microsoft\\Windows\\CurrentVersion\\Explorer\\Advanced",
                "name": "TaskbarMn",
                "value": 0,
                "type": "DWord",
                "note": "Remove the Chat icon from the Taskbar - note: this value should not be needed on Windows 11 23H2 or higher",
                "protected": false
            },
            {
                "path": "HKCU:\\Software\\Microsoft\\Windows\\CurrentVersion\\Explorer\\Advanced",
                "name": "TaskbarDa",
                "value": 0,
                "type": "DWord",
                "note": "Remove the Widgets icon from the Taskbar - note: this value is protected by permissions",
                "protected": true
            },
            {
                "path": "HKCU:\\Software\\Microsoft\\Windows\\CurrentVersion\\Start",
                "name": "VisiblePlaces",
                "value": "188 36 138 20 12 214 137 66 160 128 110 217 187 162 72 130 134 8 115 82 170 81 67 66 159 123 39 118 88 70 89 212",
                "type": "Binary",
                "note": "Adds 'Settings' and 'File Explorer' next to the power button on the Start menu.",
                "protected": false
            },
            {
                "path": "HKCU:\\Software\\Microsoft\\Windows\\CurrentVersion\\Start",
                "name": "PlacesInitializedVersion",
                "value": "2",
                "type": "Dword",
                "note": "Required to support the setting selected for VisiblePlaces.",
                "protected": false
            },
            {
                "path": "HKCU:\\Software\\Microsoft\\Windows\\CurrentVersion\\Explorer\\Advanced",
                "name": "ShowNotificationIcon",
                "value": 1,
                "type": "DWord",
                "note": "Enables 'Notifications / Show notification bell icon'",
                "protected": false
            },
            {
                "path": "HKCU:\\Software\\Microsoft\\Windows\\CurrentVersion\\Explorer\\AutoInstalledPWAs",
                "name": "CopilotPWAPreinstallCompleted",
                "value": 1,
                "type": "DWord",
                "note": "Tells Windows that the Copilot PWA has been installed",
                "protected": false
            },
            {
                "path": "HKCU:\\Software\\Microsoft\\Windows\\CurrentVersion\\Privacy",
                "name": "TailoredExperiencesWithDiagnosticDataEnabled",
                "value": 0,
                "type": "DWord",
                "note": "Disables 'Settings / Privacy & Security / Recommendations & offers / Personalised offers'",
                "protected": false
            },
            {
                "path": "HKCU:\\Software\\Microsoft\\Windows\\CurrentVersion\\CPSS\\Store\\AdvertisingInfo",
                "name": "Value",
                "value": 0,
                "type": "DWord",
                "note": "Disables 'Settings / Privacy & Security / Recommendations & offers / Advertising ID'",
                "protected": false
            },
            {
                "path": "HKCU:\\Software\\Microsoft\\Windows\\CurrentVersion\\AdvertisingInfo",
                "name": "Enabled",
                "value": 0,
                "type": "DWord",
                "note": "Disables 'Settings / Privacy & Security / Recommendations & offers / Advertising ID'",
                "protected": false
            },
            {
                "path": "HKCU:\\Software\\Microsoft\\Windows\\CurrentVersion\\ContentDeliveryManager",
                "name": "SubscribedContent-338393Enabled",
                "value": 0,
                "type": "DWord",
                "note": "Disables suggested content in the Settings app",
                "protected": false
            },
            {
                "path": "HKCU:\\Software\\Microsoft\\Windows\\CurrentVersion\\ContentDeliveryManager",
                "name": "SubscribedContent-353694Enabled",
                "value": 0,
                "type": "DWord",
                "note": "Disables suggested content in the Settings app",
                "protected": false
            },
            {
                "path": "HKCU:\\Software\\Microsoft\\Windows\\CurrentVersion\\ContentDeliveryManager",
                "name": "SubscribedContent-353696Enabled",
                "value": 0,
                "type": "DWord",
                "note": "Disables suggested content in the Settings app",
                "protected": false
            },
            {
                "path": "HKCU:\\Software\\Microsoft\\Windows\\CurrentVersion\\ContentDeliveryManager",
                "name": "SubscribedContent-338388Enabled",
                "value": 0,
                "type": "DWord",
                "note": "Disables suggested content in the Settings app",
                "protected": false
            },
            {
                "path": "HKCU:\\Software\\Microsoft\\Windows\\CurrentVersion\\ContentDeliveryManager",
                "name": "SubscribedContent-338389Enabled",
                "value": 0,
                "type": "DWord",
                "note": "Disables suggested content in the Settings app",
                "protected": false
            },
            {
                "path": "HKCU:\\Software\\Microsoft\\Windows\\CurrentVersion\\ContentDeliveryManager",
                "name": "RotatingLockScreenEnabled",
                "value": 0,
                "type": "DWord",
                "note": "Disables Windows Spotlight on the Lock Screen",
                "protected": false
            },
            {
                "path": "HKCU:\\Software\\Microsoft\\Windows\\CurrentVersion\\ContentDeliveryManager",
                "name": "SubscribedContent-338387Enabled",
                "value": 0,
                "type": "DWord",
                "note": "Disables Windows Spotlight subscribed content on the Lock Screen",
                "protected": false
            },
            {
                "path": "HKCU:\\Software\\Microsoft\\Windows\\CurrentVersion\\ContentDeliveryManager",
                "name": "SubscribedContent-338387Enabled",
                "value": 0,
                "type": "DWord",
                "note": "Disables Windows Spotlight subscribed content on the Lock Screen",
                "protected": false
            }
        ],
        "Others": [
            {
                "path": "HKCU:\\Software\\Microsoft\\Windows\\CurrentVersion\\Explorer\\Advanced",
                "name": "TaskbarAl",
                "value": 0,
                "type": "DWord",
                "note": "Aligns the Windows 11 Start button to the left of the Taskbar",
                "protected": false
            },
            {
                "path": "HKCU:\\Software\\Microsoft\\Windows\\CurrentVersion\\Explorer\\Advanced",
                "name": "ShowTaskViewButton",
                "value": 0,
                "type": "DWord",
                "note": "Removes the Task View button on the Taskbar",
                "protected": false
            },
            {
                "path": "HKCU:\\Software\\Microsoft\\Windows\\CurrentVersion\\Explorer\\Advanced",
                "name": "Start_TrackProgs",
                "value": 0,
                "type": "DWord",
                "note": "Disables 'Settings / Privacy & Security / Recommendations & offers / Improve Start and search results'",
                "protected": false
            },
            {
                "path": "HKCU:\\Software\\Microsoft\\Windows\\CurrentVersion\\SystemSettings\\AccountNotifications",
                "name": "EnableAccountNotifications",
                "value": 0,
                "type": "DWord",
                "note": "Disables 'Settings / Privacy & Security / Recommendations & offers / Show notifications in Settings'",
                "protected": false
            }
        ]
    },
    "Paths": {
        "Remove": []
    },
    "Features": {
        "Disable": []
    },
    "Capabilities": {
        "Remove": [],
        "Others": []
    },
    "Packages": {
        "Remove": []
    },
    "Shortcuts": {
        "Edit": []
    },
    "Services": {
        "Restart": [],
        "Stop": [],
        "Start": []
    },
    "Files": {
        "Copy": [
            {
                "Source": "start\\Windows11StartMenuLayout.json",
                "Destination": "C:\\Users\\Default\\AppData\\Local\\Microsoft\\Windows\\Shell\\LayoutModification.json"
            },
            {
                "Source": "start\\Windows11TaskbarLayout.xml",
                "Destination": "C:\\Users\\Default\\AppData\\Local\\Microsoft\\Windows\\Shell\\LayoutModification.xml"
            },
            {
                "Source": "start\\Windows11Start.bin",
                "Destination": "C:\\Users\\Default\\AppData\\Local\\Packages\\Microsoft.Windows.StartMenuExperienceHost_cw5n1h2txyewy\\LocalState\\start2.bin"
            }
        ]
    }
}