{
    "$schema": "https://raw.githubusercontent.com/aaronparker/defaults/refs/heads/main/schema/configuration.schema.json",
    "Description": "Default user profile settings for Windows 10.",
    "MinimumBuild": "10.0.14393.0",
    "MaximumBuild": "10.0.20999.0",
    "Targets": {
        "Platforms": [
            "client"
        ],
        "Models": [
            "physical",
            "virtual"
        ]
    },
    "MachineRegistry": {
        "ChangeOwner": [],
        "Set": [],
        "Remove": []
    },
    "UserRegistry": {
        "Set": [
            {
                "path": "HKCU:\\Software\\Microsoft\\Windows\\CurrentVersion\\Explorer\\Accent",
                "name": "AccentColor",
                "value": 4289992518,
                "type": "DWord",
                "note": "Sets the accent colour on window title bars and borders",
                "protected": false
            },
            {
                "path": "HKCU:\\Software\\Microsoft\\Windows\\CurrentVersion\\Explorer\\Accent",
                "name": "AccentPalette",
                "value": "86CAFF005FB2F2001E91EA000063B10000427500002D4F000020380000CC6A00",
                "type": "String",
                "note": "Sets the accent colour on window title bars and borders",
                "protected": false
            },
            {
                "path": "HKCU:\\Software\\Microsoft\\Windows\\DWM",
                "name": "AccentColor",
                "value": 4289815296,
                "type": "DWord",
                "note": "Sets the accent colour on window title bars and borders",
                "protected": false
            },
            {
                "path": "HKCU:\\Software\\Microsoft\\Windows\\DWM",
                "name": "ColorizationAfterglow",
                "value": 3288359857,
                "type": "DWord",
                "note": "Sets the accent colour on window title bars and borders",
                "protected": false
            },
            {
                "path": "HKCU:\\Software\\Microsoft\\Windows\\DWM",
                "name": "ColorizationColor",
                "value": 3288359857,
                "type": "DWord",
                "note": "Sets the accent colour on window title bars and borders",
                "protected": false
            }
        ]
    },
    "Paths": {
        "Remove": []
    },
    "Features": {
        "Disable": []
    },
    "Capabilities": {
        "Remove": [],
        "Others": []
    },
    "Packages": {
        "Remove": []
    },
    "Shortcuts": {
        "Edit": []
    },
    "Services": {
        "Restart": [],
        "Stop": [],
        "Start": []
    },
    "Files": {
        "Copy": [
            {
                "Source": "start\\Windows10StartMenuLayout.xml",
                "Destination": "C:\\Users\\Default\\AppData\\Local\\Microsoft\\Windows\\Shell\\LayoutModification.xml"
            }
        ]
    }
}