{
    "$schema": "https://raw.githubusercontent.com/aaronparker/defaults/refs/heads/main/schema/configuration.schema.json",
    "Description": "Configuration settings template file.",
    "MinimumBuild": "10.0.14393.0",
    "MaximumBuild": "10.0.99999.0",
    "Targets": {
        "Platforms": [
            "client",
            "multisession",
            "rds-server",
            "server"
        ],
        "Models": [
            "physical",
            "virtual"
        ]
    },
    "MachineRegistry": {
        "ChangeOwner": [],
        "Set": [],
        "Remove": []
    },
    "UserRegistry": {
        "Set": []
    },
    "Paths": {
        "Remove": []
    },
    "Features": {
        "Disable": []
    },
    "Capabilities": {
        "Remove": [],
        "Others": []
    },
    "Packages": {
        "Remove": []
    },
    "Shortcuts": {
        "Edit": []
    },
    "Services": {
        "Restart": [],
        "Stop": [],
        "Start": []
    },
    "Files": {
        "Copy": []
    }
}